{
  "$schema": "http://json-schema.org/draft-07/schema#",
  "$id": "review-findings.schema.json",
  "title": "Review findings",
  "description": "ONE findings shape for both review tracks. All six external reviewers of 9.18.1 converged on a single ask: the R2 gate hand-parses Markdown and carries `unbalanced-fence` and `malformed-row` as first-class violation kinds — i.e. it has defect classes FOR ITS OWN PARSER. This schema is deliberately NOT a new format: it is the shape `self_review_gate.ts` already emits under `--findings-out` and `check_finding_dispositions.ts` already hand-validates in code, lifted into a file both tracks can point at. Inventing a second JSON shape here would have been the exact fragmentation the reviewers complained about.",
  "type": "object",
  "required": [
    "schema_version",
    "findings"
  ],
  "additionalProperties": true,
  "properties": {
    "schema_version": {
      "enum": [
        1
      ],
      "description": "Pinned. `check_finding_dispositions.parse_ledger` already rejects anything else, so this is a promotion of an existing check rather than a new constraint. Spelled as a one-member `enum` rather than `const`: the repo's own Draft-07 subset validator (validate_frontmatter.ts) enforces `enum` and silently ignores `const`, so `const` here would have been a pin nothing checked."
    },
    "release": {
      "type": "string",
      "description": "Version the ledger belongs to. Present on the release-findings ledger (agents/evidence/release-findings/<version>.json); absent on a bare --findings-out emission, which is why it is not required here."
    },
    "review_independence": {
      "enum": [
        "cross-family",
        "same-family",
        "single-member",
        "unknown"
      ],
      "description": "Whether the reviewer set spans more than one model family. Added because the artifact was previously silent on it: the self-review gate calls ONE Anthropic client, and the ledger it wrote was byte-indistinguishable from one backed by independent models — so a consumer read 'no findings' as acceptance either way. `unknown` is an honest value for a set that was not recorded, NOT a synonym for cross-family."
    },
    "acceptance_status": {
      "enum": [
        "accepted",
        "provisional"
      ],
      "description": "What a consumer may claim this artifact establishes. DERIVED from `review_independence` (see _lib/review_independence.ts), never set independently: two fields a producer can set inconsistently reintroduce exactly the ambiguity the pair removes, and a same-family set carrying `accepted` would still read as acceptance to anyone scanning one field. Only `cross-family` yields `accepted`; `unknown` yields `provisional`, because an unrecorded member set is not evidence of independence."
    },
    "assurance": {
      "enum": [
        "unreviewed",
        "single-pass",
        "independent"
      ],
      "description": "How much INDEPENDENT evidence backs the verdict — deliberately orthogonal to how much effort the review spent. Collapsing the two is the mechanism by which a long, careful, single-model pass reads as acceptance: effort is visible in the artifact (finding count, detail, rationale) and independence is not, so a reader with only one axis substitutes the one they can see. A five-hour same-family review is `single-pass`; a terse two-family one is `independent`."
    },
    "assurance_override": {
      "type": "string",
      "pattern": "^agents/evidence/owner-directives/[^/]+\\.md$",
      "description": "Repo-relative path to a committed owner directive permitting this version to be cut although nothing reviewed it. Read by check_finding_dispositions.unreviewed_ledger_problem, which refuses an `assurance: unreviewed` ledger at an unreleased cut unless this field names a directive whose TEXT mentions the version — so the escape hatch leaves an artifact somebody signed. A PATH and never free text, deliberately: `no_findings_reason` is already free text and a non-empty one was all it took to cut 16.4.0 on a paragraph beginning \"NOT REVIEWED\". The `pattern` is what makes the path half checkable in the schema; whether the named file exists and names the version is conditional on both, which this repo's Draft-07 subset validator cannot express, so that half lives in the gate. ABSENT on every ordinary ledger: a reviewed release has nothing to override.",
      "examples": [
        "agents/evidence/owner-directives/2026-10-07-round-7a2e1c.md"
      ]
    },
    "reviewers": {
      "type": "array",
      "description": "The member names the independence verdict was derived from, recorded so the derivation is auditable rather than asserted. Provider names as `ai_council/config.ts::_VALID_PROVIDERS` spells them.",
      "items": {
        "type": "string"
      }
    },
    "no_findings_reason": {
      "type": "string",
      "minLength": 1,
      "description": "Why the finding set is empty. REQUIRED whenever a ledger file exists and `findings` is empty — enforced in check_finding_dispositions.empty_ledger_problem rather than here, because the requirement is conditional on the array length and this repo's Draft-07 subset validator resolves no `if`/`then`. The field exists because `findings: []` and a missing file made the same claim to every reader while collapsing two states that differ entirely: a review that ran and reported nothing, and a review that never ran. The reason must pick one and say how a reader can check it."
    },
    "findings": {
      "type": "array",
      "description": "May be empty. An empty array is an honest null, not a missing field — the distinction the Markdown track spells with its own §2.3 line. The item shape is INLINED rather than `$ref`-ed for the same measured reason: the subset validator does not resolve `$ref`, so a referenced definition would have validated nothing.",
      "items": {
        "type": "object",
        "required": [
          "severity",
          "kind",
          "title"
        ],
        "additionalProperties": true,
        "properties": {
          "finding_id": {
            "type": "string",
            "pattern": "^[0-9a-f]{12}$",
            "description": "First 12 hex of sha256(`kind|title|file`), per findingId() in self_review_gate.ts. Stable across runs, which is what lets the disposition ledger key on it. NOT required: an in-flight finding may not have been keyed yet, and requiring it would make the schema reject the shape the model returns before the gate stamps it. It is a FINDING id, NOT a commit SHA — a 12-hex string looks exactly like a short SHA, and searching the commit log for it finds nothing by design; the disposition lives in agents/evidence/release-findings/<version>.json."
          },
          "severity": {
            "enum": [
              "critical",
              "high",
              "medium",
              "low"
            ],
            "description": "The JSON track's four levels. The Markdown track's own severity vocabulary is a superset in spirit but a different list; mapping between them is a caller's job, not this schema's — see the mapping note in the description of `kind`."
          },
          "kind": {
            "enum": [
              "security",
              "claim",
              "correctness",
              "style"
            ],
            "description": "Finding class. Load-bearing for the id: findingId() hashes kind|title|file, so a kind change is a new finding rather than an edit of the old one."
          },
          "title": {
            "type": "string",
            "minLength": 1,
            "maxLength": 300,
            "description": "Truncated at 300 by parseFindings() in self_review_gate.ts; the bound is pinned here so a producer cannot emit a title the consumer will silently cut."
          },
          "detail": {
            "type": "string",
            "maxLength": 2000,
            "description": "Truncated at 2000 by parseFindings(). Same reasoning as `title`."
          },
          "file": {
            "type": "string",
            "description": "Repo-relative path. Optional because a finding can be about the change as a whole; findingId() folds an absent file to the empty string so the id stays stable either way. A trailing `:<n>` or `:<n>-<m>` is a line reference smuggled into the path; findingId() strips it before hashing and parseFindings() lifts it into `line`."
          },
          "line": {
            "type": "integer",
            "minimum": 1,
            "description": "1-based line the finding points at, kept out of `file` so a moved line does not mint a new finding id."
          },
          "exhibits": {
            "type": "array",
            "description": "Typed evidence that pins the finding to the reviewed text, resolved by check_finding_exhibits.ts at the exhibit's commit. Optional: a finding without one is unchanged. The per-type required fields are enforced in that checker, not here, because the subset validator resolves no `oneOf`/`if`. Types: `presence` (path, line, quote of at most 300 chars, commit), `absence` (path_glob, pattern, commit, expected), `pair` (legs: two presence exhibits), `executed` (command, exit_code, output_digest — recorded, never re-run).",
            "items": {
              "type": "object",
              "required": [
                "type"
              ],
              "additionalProperties": true,
              "properties": {
                "type": {
                  "enum": [
                    "presence",
                    "absence",
                    "pair",
                    "executed"
                  ]
                },
                "path": { "type": "string" },
                "line": { "type": "integer", "minimum": 1 },
                "quote": { "type": "string", "minLength": 1, "maxLength": 300 },
                "commit": { "type": "string", "pattern": "^[0-9a-f]{7,40}$" },
                "path_glob": { "type": "string" },
                "pattern": { "type": "string", "minLength": 1 },
                "expected": { "type": "integer", "minimum": 0 },
                "legs": { "type": "array", "items": { "type": "object" } },
                "command": { "type": "string" },
                "exit_code": { "type": "integer" },
                "output_digest": { "type": "string" }
              }
            }
          },
          "status": {
            "enum": [
              "open",
              "fixed",
              "accepted_risk",
              "false_positive",
              "still_open"
            ],
            "description": "Disposition. `fixed` / `false_positive` / `accepted_risk` are the three terminal states check_finding_dispositions accepts ON A BLOCKING ROW; `open` is the initial state, meaning nobody has looked yet. `still_open` is a fourth TERMINAL state: a row somebody re-read against a named head, confirmed as a real unfixed issue, and recorded as such. It is deliberately distinct from `open`, which the two look identical to a reader checking only for a non-empty field while being opposites — nobody looked, versus somebody looked and this is the answer. `check_finding_dispositions.TERMINAL_STATUSES` carries all four and `DISPOSITION_STATUSES` only the first three, so a BLOCKING row marked `still_open` reports as an unknown status and keeps the gate red, which is the behaviour a blocking finding that is still open should have. NOTE the underscore spelling — the Markdown track writes `accepted-risk` with a hyphen in its Status cell, and the two vocabularies are deliberately not unified here: renaming either would break committed artefacts on that track."
          },
          "rationale": {
            "type": "string",
            "description": "Why the disposition. Required by check_finding_dispositions for a non-`fixed` terminal status; enforced there rather than here because the requirement is conditional on the workflow stage, not on the document."
          },
          "verified_by": {
            "type": "string",
            "description": "Who or what confirmed the disposition."
          },
          "date": {
            "type": "string",
            "pattern": "^\\d{4}-\\d{2}-\\d{2}$",
            "description": "ISO calendar date of the disposition."
          },
          "contradicted": {
            "type": "string",
            "description": "The tree's mechanical disproof of the finding's premise, written by self_review_gate.annotateContradicted when a deletion claim names an artifact the range does not delete and the working tree still holds. A finding carrying this is NOT merge-blocking in either gate (self_review_gate.classifyBlocking and check_finding_dispositions.isBlocking both read it), and it is still reported so a human sees what was claimed and why it was set aside."
          }
        }
      }
    }
  }
}
